8A6HEP7J,Pizza Artista,Food and Drink,Restaurants,Pizza restaurant,Pizza restaurant,"5409 Johnston St, Lafayette, LA 70503",5409 Johnston St,Lafayette,Louisiana,,,70503,US,True,30.180504799999998,-92.0705352,America/Chicago,(337) 70*-****,2,,TRUE,TRUE,,True,Lafayette,Louisiana,US,https,https://pizzaartista.com,pizzaartista.com,pizzaartista.com,com,4200,2014-10-14,2026-10-14,"GoDaddy.com, LLC",purchase_dataset@pizzaartista.com,realdomain,1,1,0,Casual cafe offering create-your-own pizza & salad combinations with a variety of ingredients.,TRUE,TRUE,4.59,748,"{""1"": 27, ""2"": 17, ""3"": 31, ""4"": 92, ""5"": 618}","Outdoor seating, Curbside pickup, Delivery, Takeout, Dine-in",Fast service,"Lunch, Dinner, Solo dining","Wheelchair accessible entrance, Wheelchair accessible parking lot, Wheelchair accessible restroom, Wheelchair accessible seating","Alcohol, Beer, Comfort food, Late-night food, Quick bite, Vegan options, Vegetarian options, Wine","Lunch, Dinner, Counter service, Dessert, Seating","Restroom, Wi-Fi","Casual, Trendy","College students, Family-friendly, Groups, Tourists",,"Credit cards, Debit cards, NFC mobile payments","Good for kids, High chairs, Kids' menu",TRUE,TRUE,purchase_dataset@,TRUE,TRUE,5,2024-05-03,2026-02-25,711,48,69,711,711,48,48,https://www.instagram.com/pizza_artista,pizza_artista,,,https://twitter.com/pizzaartista,pizzaartista,https://www.tiktok.com/@pizzaartista,pizzaartista,https://www.linkedin.com/in/scott-mcclaskey-448979148,scott-mcclaskey-448979148,https://www.youtube.com/c/thepizzaartist,thepizzaartist,,,,,,,1588,0.04,,0.04,0.04,0.04,1235,1620,73,23953,3.16,,,,3.22,https://pizzaartista.com/lafayette-la,,,2026-04-09T20:09:17.030129+00:00,1.34,0.0,0.2,6813.84,125.8,121.2485,0.81,91.8,95.8,90.2,0.8002,,0.6,0.6035,0.655,0.4828,0.6199,0.3868,80.0,82.8,,,,80.0,20.0,0.0,81.25,12.5,6.25,82.05,12.82,5.13,stable,declining,,-2.8,-0.055,-3.4,0,5,16,39,-37.5,-48.7,-100.0,79.5,9.5,92,100,83.2,98.0,96,418,136,1692,6083,2380,152719,411750,214607,164134,96,447242,50,421813,193994,101,330741,369650,101,465592,139,598,1209,10973,22810,735647,1464979,735647,0.4521,0.0875,0.5016,-0.0875,0.0984,0.4361,0.0425,0.3337,-0.0425,0.2663,0.6601,0.0336,0.4869,-0.0336,0.1131,100,49,100,447242,368704,421813,0.394,0.4946,0.4336,0.4873,0.4828,62.4,3.98,384,77.0,0.4836,17.1,0.61,364,13.2,0.3166,193994,249210,330741,0.7376,0.6539,0.5629,0.6271,0.6199,74.6,4.31,681,82.1,0.5981,4.9,0.28,67,8.1,0.2021,369650,395043,465592,0.5018,Average,0.4582,0.3796,0.4369,0.3868,Strong,74.3,4.3,678,81.9,Average,0.5795,5.2,0.29,70,8.3,0.2207,50,101,101,511,64,competitive,0.0383,15.6,6.1,24.5,69.4,0.0,2976,1045,competitive,0.0109,1.27,0.0,0.0,87.0,13.0,7188,5048,competitive,0.0109,0.32,0.0,0.0,80.0,20.0,0.0472,0.5778,-0.0472,0.0222,100,101,56,246,124,0.9147,0.6228,0.8159,0.726,0.8443,77.0,4.45,802,86.1,0.6672,2.5,0.14,-54,4.1,0.133,competitive,0.0092,0.69,0.0,0.0,72.0,28.0,0.7975,0.82,6.34,0.0844,0.7047,-0.0844,-0.1047,100,101,519,3679,2175,0.9539,0.6781,0.8144,0.7758,0.8776,80.0,4.67,1187,91.9,0.7521,-0.5,-0.08,-439,-1.7,0.0481,competitive,0.0063,0.0007,1.12,0.17,0.8293,0.08,0.3009,-0.08,0.2991,793989,61.4,3.79,385,76.0,0.4601,18.1,0.8,363,0.3401,0.9473,0.6907,0.7929,0.7833,0.872,40436,0.824,14.2,240121,164101,25.1,59.3,4.4,11.2,793990,451,61.9,4.32,325,79.2,0.4968,17.6,0.27,423,0.3034,0.9244,0.6067,0.8489,0.7289,0.8489,34,57.51,33.25,0.8133,451,8.24,1214,833,0.6605,6605.12,0.21,46578,34,0.0255,254.76,14.64,200.0,1.18,99.01,1.19,99.01,0.85,99.01,0.39,99.01,-1.3,0.0,-1,-0.1,-23.3,,,,,,0.02,-8062,0.018,-81.36,370437,-0.498,0.05,-35893,0.051,-81.04,116266,-0.155,0.06,-42182,0.064,-81.25,292293,-0.39,-0.03,20,-0.028,-81.0,-84152,0.021,-0.02,107,-0.009,-80.97,-83933,0.06,0.8002,,,748,0.0,0.0,0.0,0.0,decelerating,0.10,0.70,3.00,3,12,53,0.557,0.570,0.571,0.456,0.579,331227,345950,344596,25,114,decelerating,0.07,,90.76
UHWGHM44,Marcello's,Food and Drink,Restaurants,Italian restaurant,"Italian restaurant, Wine store","340 Kaliste Saloom Rd Suite C, Lafayette, LA 70508",340 Kaliste Saloom Rd Suite C,Lafayette,Louisiana,,,70508,US,True,30.184043499999998,-92.0170344,America/Chicago,(337) 23*-****,3,OPERATIONAL,TRUE,TRUE,,True,Lafayette,Louisiana,US,http,http://marcelloslafayette.com,marcelloslafayette.com,marcelloslafayette.com,com,1840,2021-03-31,2027-03-31,Squarespace Domains LLC,"purchase_dataset@maclaff.com, purchase_dataset@marcelloslafayette.com, purchase_dataset@marcelloslafayette.com, purchase_dataset@marcelloslafayette.com",realdomain,4,4,0,"Upscale, romantic establishment featuring traditional Italian cuisine & an extensive wine selection.",TRUE,TRUE,4.71,633,"{""1"": 14, ""2"": 5, ""3"": 18, ""4"": 75, ""5"": 541}","Outdoor seating, Takeout, Dine-in","Great cocktails, Great coffee, Great dessert, Great wine list, Serves local specialty","Lunch, Dinner, Solo dining","Wheelchair accessible entrance, Wheelchair accessible parking lot, Wheelchair accessible restroom, Wheelchair accessible seating","Alcohol, Beer, Cocktails, Coffee, Comfort food, Happy hour drinks, Happy hour food, Hard liquor, Private dining room, Small plates, Vegetarian options, Wine","Lunch, Dinner, Dessert, Seating, Table service","Bar onsite, Restroom","Cozy, Quiet, Romantic, Trendy, Upscale","Groups, Tourists","Dinner reservations recommended, Accepts reservations","Credit cards, Debit cards, NFC mobile payments",High chairs,TRUE,TRUE,purchase_dataset@,TRUE,TRUE,3,2023-10-05,2025-12-10,922,125,55,922,922,125,125,https://www.instagram.com/marcelloswinemarketcafe,marcelloswinemarketcafe,https://www.facebook.com/marcelloslafayette,marcelloslafayette,,,https://www.tiktok.com/@distillerieacadian,distillerieacadian,,,,,,,,,,,2439,1.56,,,1.64,1.56,432,549,23,1067,3.95,,,,,https://marcelloslafayette.com/dinner-menu,https://opentable.com/restaurant/profile/190978,https://opentable.com/restaurant/profile/190978,2026-04-09T20:09:16.952652+00:00,2.01,0.16,0.1,6948.76,209.6,121.2485,0.81,94.2,93.4,94.2,0.8562,,0.9444,0.8474,0.9161,0.6385,0.8039,0.2858,97.2,95.8,,,,100.0,0.0,0.0,95.45,4.55,0.0,97.5,2.5,0.0,stable,stable,,1.4,0.0283,1.5,0,9,22,40,-18.2,-10.0,-100.0,83.4,27.4,76,100,96.2,98.0,128,280,183,2253,4254,3170,186018,288172,266293,199371,128,357145,34,409432,105309,101,290395,443177,101,524506,76,598,1209,10973,22810,735647,1464979,735647,0.3549,0.0287,0.4562,-0.0287,0.4849,0.5168,0.0455,0.45,-0.0455,0.4911,0.777,0.0597,0.5249,-0.0597,0.4162,100,33,100,357145,299913,409432,0.514,0.5874,0.45,0.5695,0.6385,63.9,4.06,392,78.4,0.53,19.5,0.65,241,15.8,0.3262,105309,117282,290395,0.8561,0.8325,0.6162,0.8341,0.8039,76.5,4.43,725,85.7,0.6597,6.9,0.28,-92,8.5,0.1965,443177,484633,524506,0.4055,Average,0.3411,0.3013,0.2971,0.2858,Strong,72.5,4.22,585,79.5,Below Average,0.5431,10.9,0.49,48,14.7,0.3131,34,101,101,723,345,competitive,0.0467,10.5,6.1,18.2,60.6,15.2,3633,1146,competitive,0.0086,1.27,0.0,0.0,76.0,24.0,6993,5091,competitive,0.0107,0.32,0.0,2.0,95.0,3.0,0.0472,0.5779,-0.0472,0.3632,100,101,14,166,169,0.9775,0.7515,0.7485,0.8503,0.9117,77.0,4.44,811,85.9,0.6636,6.4,0.27,-178,8.3,0.1926,competitive,0.0077,0.69,0.0,0.0,73.0,27.0,0.841,0.82,6.34,0.0844,0.7152,-0.0844,0.2259,100,101,94,2768,2830,0.9915,0.7568,0.7583,0.8688,0.9267,79.9,4.67,1191,91.9,0.7566,3.5,0.04,-558,2.3,0.0996,competitive,0.0053,0.0007,1.12,0.17,0.8511,0.08,0.3009,-0.08,0.6402,793989,61.4,3.79,385,76.0,0.4601,22.0,0.92,248,0.3961,0.9905,0.7684,0.7485,0.8786,0.928,7158,0.8513,18.2,179416,199351,25.1,59.3,4.4,11.2,793990,451,61.9,4.32,325,79.2,0.4968,21.5,0.39,308,0.3594,0.9911,0.7333,0.8022,0.8667,0.9222,5,57.51,36.64,0.9089,451,8.24,1214,833,0.6685,6684.71,0.21,46578,34,0.0256,255.71,21.76,294.12,0.75,99.01,1.15,99.01,0.6,99.01,0.28,99.01,1.4,0.0,-2,0.0,-9.4,,,,,,0.03,-26433,0.042,-84.68,327405,-0.444,0.04,-26261,0.038,-84.42,75258,-0.102,0.05,-46690,0.07,-84.85,413211,-0.552,-0.01,-10,0.013,-84.36,-32502,0.019,-0.01,-148,0.014,-84.45,-32494,0.033,0.8562,,,633,0.03,1.0,0.529,0.416,decelerating,0.03,0.23,1.00,1,11,41,0.502,0.511,0.512,0.529,0.416,255757,268998,267956,4,45,decelerating,-0.10,,94.15
LQWRH649,La Pizzeria Lafayette,Food and Drink,Restaurants,Italian restaurant,"Italian restaurant, Caterer, Takeout Restaurant, Pizza restaurant, Salad shop, Sandwich shop","3809 Ambassador Caffery Pkwy, Lafayette, LA 70503",3809 Ambassador Caffery Pkwy,Lafayette,Louisiana,,,70503,US,True,30.170133999999997,-92.06395599999999,America/Chicago,(337) 98*-****,2,,TRUE,TRUE,,True,Lafayette,Louisiana,US,https,https://eatatlapizzeria.com,eatatlapizzeria.com,eatatlapizzeria.com,com,2198,2020-04-07,2032-04-07,"GoDaddy.com, LLC",purchase_dataset@omwholdings.com,,1,1,0,"Restaurant offering pizzas, pasta & sandwiches, along with a wine list, in a relaxed space.",TRUE,TRUE,4.12,249,"{""1"": 22, ""2"": 14, ""3"": 22, ""4"": 46, ""5"": 145}","Outdoor seating, Curbside pickup, No-contact delivery, Delivery, Takeout, Dine-in","Fast service, Great beer selection, Great cocktails, Great dessert, Great wine list, Live music, Serves local specialty","Lunch, Dinner, Solo dining","Wheelchair accessible entrance, Wheelchair accessible parking lot, Wheelchair accessible restroom, Wheelchair accessible seating","Alcohol, Beer, Cocktails, Coffee, Comfort food, Happy hour drinks, Hard liquor, Quick bite, Small plates, Vegan options, Vegetarian options, Wine","Lunch, Dinner, Catering, Counter service, Dessert, Seating, Table service","Bar onsite, Restroom, Wi-Fi","Casual, Cozy, Quiet, Trendy","Family-friendly, Groups, Tourists",Accepts reservations,"Checks, Credit cards, Debit cards, NFC mobile payments","Good for kids, High chairs, Kids' menu",TRUE,TRUE,purchase_dataset@,TRUE,TRUE,2,2025-06-06,2025-08-29,312,228,45,312,312,228,228,,,,,https://twitter.com/eatalia2,eatalia2,https://www.tiktok.com/@eatalianpizzeria,eatalianpizzeria,,,,,,,,,,,,,,,,,,6502,145,86242,2.79,,,,2.79,https://lapizzeria.hrpos.heartland.us/menu,,,2026-04-09T20:08:56.516705+00:00,5.39,0.0,1.0,6827.52,316.0,121.2485,0.82,82.4,79.9,76.7,0.5614,,0.4995,-0.0281,0.343,0.3104,0.6689,0.4089,75.0,67.2,,,,66.67,0.0,33.33,37.5,37.5,25.0,62.5,25.0,12.5,stable,improving,,7.8,0.1565,11.6,0,3,8,24,-25.0,-50.0,-100.0,70.2,9.5,56,100,82.1,98.0,283,910,456,4711,13985,7031,351775,913818,550477,376548,283,575463,26,444866,183928,101,309534,359731,101,469474,364,598,1209,10973,22810,735647,1464979,735647,0.4605,0.1002,0.517,-0.1002,0.1076,0.2664,0.0729,0.0699,-0.0729,0.5547,0.6842,0.0263,0.4661,-0.0263,0.1585,100,25,100,575463,604039,444866,0.225,0.1854,0.4026,0.3554,0.3104,59.7,3.66,369,74.7,0.4316,10.5,0.46,-120,2.0,0.1298,183928,224228,309534,0.751,0.6883,0.591,0.6813,0.6689,74.8,4.33,704,82.9,0.6131,-4.6,-0.21,-455,-6.2,-0.0517,359731,382099,469474,0.5148,Below Average,0.4744,0.3744,0.4492,0.4089,Strong,74.5,4.31,672,82.1,Average,0.587,-4.3,-0.19,-423,-5.4,-0.0256,26,101,101,367,11,competitive,0.0263,7.96,16.0,32.0,52.0,0.0,2627,1072,competitive,0.0035,1.27,0.0,0.0,86.0,14.0,7455,5016,competitive,0.0037,0.32,0.0,0.0,81.0,19.0,0.0472,0.5838,-0.0472,0.0408,100,101,247,496,332,0.6243,0.256,0.5045,0.3308,0.4955,77.1,4.45,806,86.1,0.6674,-6.9,-0.33,-557,-9.4,-0.106,competitive,0.0031,0.69,0.0,0.0,72.0,28.0,0.4778,0.82,6.35,0.0844,0.7082,-0.0844,-0.0836,100,101,3456,7869,6049,0.7011,0.325,0.482,0.4178,0.5705,79.9,4.67,1185,91.9,0.7518,-9.7,-0.55,-936,-15.2,-0.1904,competitive,0.0021,0.0007,1.12,0.17,0.5225,0.08,0.3009,-0.08,0.3237,793989,61.4,3.79,385,76.0,0.4601,8.8,0.33,-136,0.1013,0.6854,0.3287,0.5255,0.4142,0.5453,247156,0.5304,0.7,528868,376099,25.1,59.3,4.4,11.2,793990,451,61.9,4.32,325,79.2,0.4968,8.3,-0.2,-76,0.0646,0.6467,0.2178,0.5422,0.3089,0.4889,160,57.51,26.76,0.6178,451,8.24,1214,833,0.6642,6642.2,0.21,46578,34,0.0254,254.47,6.92,384.62,0.12,99.01,0.14,99.01,0.09,99.01,0.04,99.01,0.1,0.0,0,0.0,-33.3,,,,,,0.02,7545,0.0,-42.03,150393,-0.189,0.05,-31690,0.045,-41.72,-246117,0.336,0.05,-37913,0.058,-41.94,-64680,0.098,-0.02,-1,-0.006,-41.92,-471074,0.208,-0.02,-129,0.015,-41.98,-470384,0.284,0.5614,,,249,0.0,0.0,0.0,0.0,decelerating,0.10,0.70,3.00,3,6,26,0.557,0.570,0.571,0.412,0.324,331227,345950,344596,10,85,accelerating,0.00,,84.27
CJWDVLGR,Pizza Village,Food and Drink,Restaurants,Pizza restaurant,"Pizza restaurant, Family restaurant, Italian restaurant, Takeout Restaurant, Pasta shop, Restaurant, Salad shop, Sandwich shop","2340 Kaliste Saloom Rd, Lafayette, LA 70508",2340 Kaliste Saloom Rd,Lafayette,Louisiana,,,70508,US,True,30.1598348,-92.0464897,America/Chicago,(337) 70*-****,2,OPERATIONAL,TRUE,TRUE,,True,Lafayette,Louisiana,US,http,http://pizzavillage.com,pizzavillage.com,pizzavillage.com,com,9824,1999-05-22,2026-05-22,"GoDaddy.com, LLC",purchase_dataset@pizzavillage.com,realdomain,1,1,0,Custom pies plus Southern-style Italian sandwiches are featured in this lively & spacious setting.,TRUE,TRUE,4.52,1092,"{""1"": 46, ""2"": 23, ""3"": 72, ""4"": 186, ""5"": 947}","Outdoor seating, No-contact delivery, Delivery, Drive-through, Onsite services, Takeout, Dine-in","Fast service, Great beer selection, Great cocktails, Great wine list, Serves local specialty, Sports","Lunch, Dinner, Solo dining","Wheelchair accessible entrance, Wheelchair accessible parking lot, Wheelchair accessible restroom, Wheelchair accessible seating","Alcohol, Beer, Cocktails, Coffee, Comfort food, Happy hour drinks, Happy hour food, Hard liquor, Late-night food, Private dining room, Quick bite, Small plates, Wine","Lunch, Dinner, Catering, Counter service, Dessert, Seating, Table service","Bar onsite, Restroom, Wi-Fi","Casual, Cozy, Trendy","College students, Family-friendly, Groups, Tourists",Accepts reservations,"Credit cards, Debit cards, NFC mobile payments","Good for kids, Good for kids birthday, High chairs, Kids' menu",TRUE,TRUE,purchase_dataset@,TRUE,TRUE,3,2020-10-11,2025-04-24,2011,355,24,2011,2011,355,355,https://www.instagram.com/pizzavillagehopewell,pizzavillagehopewell,https://www.facebook.com/pizzavillagehopewell,pizzavillagehopewell,,,,,https://www.linkedin.com/company/pizza-village-la,pizza-village-la,,,,,,,,,175,4.29,,,,0.0,33,,,,,,,,,https://pizzavillage.com/menu,,,2026-04-09T20:08:56.382620+00:00,0.14,0.16,0.4,6856.78,209.6,121.2485,0.81,90.4,100.0,88.4,0.7592,,0.5394,0.5993,0.701,0.4454,0.6824,0.4504,77.0,85.0,,,,71.43,14.29,14.29,77.78,16.67,5.56,84.72,12.5,2.78,stable,declining,,-8.0,-0.1616,-9.4,0,7,18,72,-22.2,-61.1,-100.0,80.1,27.4,76,100,80.7,98.0,18,504,25,409,7330,498,47501,487856,60173,51112,18,196965,74,305422,237892,101,354941,344761,101,528720,182,598,1209,10973,22810,735647,1464979,735647,0.4665,0.0852,0.551,-0.0852,-0.0116,0.6517,0.086,0.2637,-0.086,0.2757,0.6474,0.042,0.4909,-0.042,0.0485,100,73,100,196965,283439,305422,0.7298,0.6098,0.5893,0.5166,0.4454,66.7,4.08,460,77.5,0.4727,13.4,0.44,632,10.9,0.2865,237892,200151,354941,0.68,0.7206,0.5308,0.6937,0.6824,73.7,4.35,657,83.1,0.6172,6.4,0.17,435,5.3,0.142,344761,325999,528720,0.5345,Strong,0.5465,0.2957,0.5209,0.4504,Average,74.8,4.35,578,83.2,Average,0.6006,5.3,0.17,514,5.2,0.1586,74,101,101,508,66,competitive,0.0315,23.24,1.4,23.3,71.2,4.1,3572,1139,competitive,0.0164,1.27,0.0,1.0,86.0,13.0,7119,5013,competitive,0.0186,0.32,0.0,0.0,83.0,17.0,0.0472,0.5843,-0.0472,-0.0449,100,101,42,300,47,0.9356,0.5479,0.9311,0.6347,0.7829,77.0,4.45,798,86.2,0.6663,3.1,0.07,294,2.2,0.0929,competitive,0.0135,0.69,0.0,0.0,73.0,27.0,0.818,0.82,6.34,0.0744,0.7039,-0.0744,-0.1645,100,101,402,4321,656,0.9647,0.6239,0.9435,0.7182,0.8255,79.9,4.67,1184,92.0,0.7541,0.2,-0.15,-92,-3.6,0.0051,competitive,0.0091,0.0007,1.12,0.17,0.8561,0.08,0.3009,-0.08,0.2385,793989,61.4,3.79,385,76.0,0.4601,18.7,0.73,707,0.2991,0.9573,0.6365,0.9352,0.7293,0.8189,32684,0.8544,12.4,282411,51021,25.1,59.3,4.4,11.2,793990,451,61.9,4.32,325,79.2,0.4968,18.2,0.2,767,0.2624,0.9378,0.5333,0.9667,0.64,0.7822,27,57.51,31.92,0.7822,451,8.24,1214,833,0.6575,6574.72,0.21,46578,34,0.0254,254.22,9.93,135.14,2.67,99.01,3.44,99.01,1.82,99.01,0.84,99.01,-2.2,0.0,-1,0.0,-34.4,,,,,,0.03,-27416,0.041,-85.05,183844,-0.251,0.05,-39692,0.057,-84.95,224631,-0.301,0.05,-52883,0.077,-85.13,331523,-0.446,-0.04,20,-0.032,-84.78,-14281,-0.046,-0.02,184,-0.016,-84.74,-13945,-0.017,0.7592,,,1092,0.03,1.0,0.5,0.479,decelerating,0.03,0.23,1.00,1,8,79,0.502,0.511,0.512,0.500,0.479,255757,268998,267956,18,65,decelerating,-0.10,,89.43
RTYKVH94,BJ's Restaurant & Brewhouse,Food and Drink,Restaurants,Restaurant,"Restaurant, Brewery, Brewpub, Dessert restaurant, Family restaurant, Takeout Restaurant, Pizza restaurant, Sports bar","4511 Ambassador Caffery Pkwy, Lafayette, LA 70508",4511 Ambassador Caffery Pkwy,Lafayette,Louisiana,,,70508,US,True,30.1552744,-92.0462348,America/Chicago,(337) 76*-****,1,OPERATIONAL,TRUE,TRUE,,True,Lafayette,Louisiana,US,https,https://bjsrestaurants.com/locations/la/lafayette,bjsrestaurants.com/locations/la/lafayette,bjsrestaurants.com,com,8097,2004-02-12,2029-02-12,"Network Solutions, LLC","purchase_dataset@bjsrestaurants.com, purchase_dataset@bjsrestaurants.com, purchase_dataset@bjri.com, purchase_dataset@bjri.com, purchase_dataset@bjsrestaurants.com, purchase_dataset@computershare.com, purchase_dataset@hendelcontent.com, purchase_dataset@bjsrestaurants.com",realdomain,8,2,6,Family-friendly chain outpost pairs familiar pub fare with an extensive list of house brews.,TRUE,TRUE,4.19,1140,"{""1"": 124, ""2"": 64, ""3"": 87, ""4"": 258, ""5"": 952}","Curbside pickup, Delivery, Onsite services, Takeout, Dine-in","Fast service, Great beer selection, Great cocktails, Great dessert, Great tea selection, Great wine list, Serves local specialty, Sports","Lunch, Dinner, Solo dining","Wheelchair accessible entrance, Wheelchair accessible parking lot, Wheelchair accessible restroom, Wheelchair accessible seating","Alcohol, Beer, Cocktails, Coffee, Comfort food, Happy hour drinks, Happy hour food, Hard liquor, Healthy options, Late-night food, Quick bite, Small plates, Vegetarian options, Wine","Lunch, Dinner, Catering, Dessert, Seating, Table service","Bar onsite, Restroom","Casual, Cozy, Trendy","College students, Groups, Tourists",Accepts reservations,"Credit cards, Debit cards, NFC mobile payments","Good for kids, Has changing table(s), High chairs, Kids' menu",TRUE,TRUE,purchase_dataset@,TRUE,TRUE,6,2025-08-21,2026-03-04,236,41,104,236,236,41,41,https://www.instagram.com/bjsrestaurants,bjsrestaurants,https://www.facebook.com/bjsrestaurants,bjsrestaurants,https://twitter.com/bjsrestaurants,bjsrestaurants,https://www.tiktok.com/@bjsrestaurants,bjsrestaurants,,,https://www.youtube.com/user/bjsrestaurants,bjsrestaurants,,,,,https://www.pinterest.com/bjsrestaurants,bjsrestaurants,139628,3.59,,2.9,3.59,3.59,2957,147754,460,3209298,5.48,,1.19,4.97,5.48,https://bjsrestaurants.com/menu,https://bjsrestaurants.com/locations/la/lafayette,https://bjsrestaurants.com/locations/la/lafayette,2026-04-09T20:08:56.295974+00:00,119.03,0.16,0.0,6948.92,105.0,121.2485,0.81,83.8,100.0,79.5,0.5938,,0.6327,0.612,0.6658,0.4517,0.7094,0.522,81.6,83.3,,,,78.57,14.29,7.14,80.52,18.18,1.3,83.15,15.73,1.12,stable,stable,,-1.7,-0.0331,-2.0,0,14,77,178,-63.6,-68.5,-100.0,80.3,27.4,100,100,84.0,98.0,12,857,16,192,13049,228,30912,851398,38464,33086,12,217447,63,283659,247695,101,372934,328597,101,528112,347,598,1209,10973,22810,735647,1464979,735647,0.487,0.0952,0.5597,-0.0952,0.1248,0.646,0.1013,0.2386,-0.1013,0.4459,0.6352,0.037,0.5046,-0.037,0.1799,100,62,100,217447,291595,283659,0.702,0.5987,0.6186,0.4933,0.4517,66.3,4.07,475,77.1,0.4746,14.0,0.12,665,2.4,0.1192,247695,200151,372934,0.6673,0.7206,0.5071,0.7062,0.7094,73.5,4.35,640,83.3,0.6257,6.8,-0.16,500,-3.8,-0.0319,328597,295917,528112,0.5555,Average,0.5862,0.2965,0.571,0.522,Average,75.1,4.37,579,83.9,Average,0.6232,5.2,-0.18,561,-4.4,-0.0294,63,101,101,438,91,competitive,0.0373,19.74,1.6,21.0,74.2,3.2,3451,1037,competitive,0.0175,1.27,0.0,1.0,86.0,13.0,6928,5051,competitive,0.0193,0.32,0.0,0.0,83.0,17.0,0.0472,0.5864,-0.0472,0.0981,100,101,41,474,18,0.9401,0.2889,0.9731,0.3802,0.5464,77.1,4.45,800,86.2,0.6677,3.2,-0.26,340,-6.7,-0.0739,competitive,0.0141,0.69,0.0,0.0,73.0,27.0,0.7546,0.82,6.35,0.0744,0.7023,-0.0744,-0.0178,100,101,372,7386,425,0.9671,0.3641,0.9635,0.4735,0.6063,79.9,4.67,1185,91.9,0.7517,0.4,-0.48,-45,-12.4,-0.1579,competitive,0.0095,0.0007,1.12,0.17,0.7851,0.08,0.3009,-0.08,0.3836,793989,61.4,3.79,385,76.0,0.4601,18.9,0.4,755,0.1337,0.9604,0.3709,0.9582,0.4724,0.5838,30235,0.7829,3.5,494561,32889,25.1,59.3,4.4,11.2,793990,451,61.9,4.32,325,79.2,0.4968,18.4,-0.13,815,0.097,0.9444,0.2467,0.9778,0.3689,0.5333,24,57.51,25.88,0.5978,451,8.24,1214,833,0.6588,6587.9,0.21,46578,34,0.0254,254.47,13.9,158.73,3.06,99.01,3.73,99.01,1.98,99.01,0.91,99.01,0.2,0.0,-5,0.0,-14.8,,,,,,0.02,-16824,0.027,-76.85,181917,-0.248,0.05,-39631,0.058,-76.86,211781,-0.282,0.06,-58882,0.085,-76.91,292803,-0.394,-0.01,-7,0.011,-76.75,-38784,-0.01,-0.01,-143,0.014,-76.71,-38538,0.017,0.5938,,,1140,0.03,1.0,0.441,0.517,decelerating,0.03,0.23,1.00,1,50,189,0.502,0.511,0.512,0.441,0.517,255757,268998,267956,45,369,decelerating,-0.27,,83.39
Y3Q8TCM9,iMonelli Restaurant,Food and Drink,Restaurants,Italian restaurant,"Italian restaurant, Restaurant","4017 Johnston St, Lafayette, LA 70503",4017 Johnston St,Lafayette,Louisiana,,,70503,US,True,30.1976241,-92.0557422,America/Chicago,(337) 98*-****,3,OPERATIONAL,TRUE,TRUE,,True,Lafayette,Louisiana,US,,,,,,,,,,,,0,0,0,"Chic yet relaxed place with a menu full of seafood, steak & pasta dishes plus rotating specials.",TRUE,TRUE,4.57,271,"{""1"": 9, ""2"": 4, ""3"": 16, ""4"": 36, ""5"": 207}","Takeout, Dine-in","Great cocktails, Great dessert, Great wine list, Serves local specialty","Lunch, Dinner, Solo dining","Wheelchair accessible entrance, Wheelchair accessible parking lot, Wheelchair accessible restroom, Wheelchair accessible seating","Alcohol, Beer, Cocktails, Coffee, Comfort food, Hard liquor, Private dining room, Wine","Lunch, Dinner, Dessert, Seating, Table service","Bar onsite, Restroom","Cozy, Romantic, Upscale",Groups,"Dinner reservations recommended, Accepts reservations","Credit cards, Debit cards, NFC mobile payments",High chairs,FALSE,FALSE,purchase_dataset@,FALSE,TRUE,0,,,,,,,,,,,,,,,,,,,,,,,,,,,,,,,,,,,,,,,,,,,,,,2026-04-09T20:08:35.083653+00:00,0.0,0.0,4.7,6642.2,631.6,121.2485,0.82,91.4,81.2,89.3,0.7787,,1.0,0.5,0.8547,0.6612,0.7952,0.1513,100.0,92.7,,,,100.0,0.0,0.0,75.0,25.0,0.0,95.24,4.76,0.0,stable,improving,,7.3,0.1453,7.9,0,1,4,21,-50.0,-81.0,-100.0,65.7,9.5,0,50,97.3,98.0,270,444,426,4505,6481,6651,337783,436218,524882,361598,270,249959,25,464376,109205,101,257600,519011,101,585120,153,598,1209,10973,22810,735647,1464979,735647,0.2619,0.0499,0.3812,-0.0499,0.6188,0.4935,-0.0417,0.3479,0.0417,0.6521,0.7917,0.0416,0.5154,-0.0416,0.4846,100,24,100,249959,446564,464376,0.658,0.3912,0.3766,0.7296,0.6612,65.7,3.89,356,81.3,0.5373,0.0,0.68,-85,8.0,0.2414,109205,107777,257600,0.8508,0.8454,0.6592,0.8391,0.7952,76.4,4.44,760,85.8,0.6562,-10.7,0.13,-489,3.5,0.1225,519011,561598,585120,0.3063,Average,0.2438,0.2208,0.1729,0.1513,Strong,69.8,4.13,478,76.8,Below Average,0.479,-4.1,0.44,-207,12.5,0.2997,25,101,101,472,70,competitive,0.0307,7.64,12.5,8.3,75.0,4.2,3619,1071,competitive,0.0036,1.27,0.0,0.0,76.0,24.0,6838,5009,competitive,0.0056,0.32,0.0,8.0,87.0,5.0,0.0472,0.5838,-0.0472,0.4162,100,101,349,260,319,0.476,0.6078,0.524,0.6766,0.8159,77.1,4.45,806,86.1,0.6674,-11.4,0.12,-535,3.2,0.1113,competitive,0.0034,0.69,0.0,0.0,72.0,28.0,0.5299,0.82,6.35,0.0744,0.7067,-0.0744,0.2933,100,101,5296,3869,5709,0.5457,0.6625,0.5117,0.7471,0.8492,79.9,4.67,1184,92.0,0.7544,-14.2,-0.1,-913,-2.7,0.0243,competitive,0.0023,0.0007,1.12,0.17,0.5705,0.08,0.3009,-0.08,0.6991,793989,61.4,3.79,385,76.0,0.4601,4.3,0.78,-114,0.3186,0.5337,0.6755,0.544,0.7568,0.845,367571,0.5793,13.3,251363,361459,25.1,59.3,4.4,11.2,793990,451,61.9,4.32,325,79.2,0.4968,3.8,0.25,-54,0.2819,0.5089,0.5867,0.5644,0.6756,0.82,219,57.51,33.63,0.8244,451,8.24,1214,833,0.6642,6642.2,0.21,46578,34,0.0254,254.18,9.43,400.0,0.13,99.01,0.32,99.01,0.11,99.01,0.05,99.01,-4.5,0.0,-1,0.0,-42.9,,,,,,0.01,-5209,0.011,-54.61,-171514,0.24,0.04,-22365,0.033,-54.31,-317179,0.431,0.05,-39959,0.062,-54.94,98215,-0.115,-0.08,108,-0.156,-54.67,-466969,0.055,-0.08,1711,-0.14,-54.63,-464509,0.124,0.7787,,,271,0.0,0.0,0.0,0.0,decelerating,0.07,0.47,2.00,2,3,26,0.439,0.452,0.454,0.235,0.225,417455,437538,435431,12,98,accelerating,0.07,,91.14
