beam_id,title,category_main_group,category_sub_group,category,categories,address,street,city,state,borough,neighborhood,postal_code,country,address_verified,latitude,longitude,timezone,phone,price_level,business_status,has_open_hours,has_price,census_place,verified_census_city,beam_location_name,beam_state_code,beam_country_code,website_protocol,website,website_normalized,website_domain,website_domain_tld,website_domain_age,website_domain_registered,website_domain_expires,website_domain_registrar,emails_list,emails_list_website_domain,emails_count,emails_deliverable_count,emails_risky_count,description,has_about,has_description,rating,reviews_total_count,reviews_per_rating,service_options,highlights,popular_for,accessibility,offerings,dining_options,amenities,atmosphere,crowd,planning,payments,children,has_popular_times,has_website,has_email,has_social,has_phone,socials_count,first_social_post_date,last_social_post_date,first_social_post_days,last_social_post_days,social_post_count,first_social_post_days_min,first_social_post_days_max,last_social_post_days_min,last_social_post_days_max,social_profile_instagram,social_username_instagram,social_profile_facebook,social_username_facebook,social_profile_twitter,social_username_twitter,social_profile_tiktok,social_username_tiktok,social_profile_linkedin,social_username_linkedin,social_profile_youtube,social_username_youtube,social_profile_github,social_username_github,social_profile_snapchat,social_username_snapchat,social_profile_pinterest,social_username_pinterest,instagram_followers,instagram_engagement_rate,instagram_engagement_rate_1m,instagram_engagement_rate_3m,instagram_engagement_rate_6m,instagram_engagement_rate_12m,instagram_post_count,tiktok_followers,tiktok_video_count,tiktok_heart_count,tiktok_engagement_rate,tiktok_engagement_rate_1m,tiktok_engagement_rate_3m,tiktok_engagement_rate_6m,tiktok_engagement_rate_12m,menu_link,order_links,reservation_link,last_updated_at,beam_cross_social_market_penetration,beam_cross_velocity_quality,beam_cross_social_urgency,beam_cross_per_capita_engagement,beam_cross_market_saturation_lead,beam_cross_population_adjusted_rank,beam_cross_demand_gap_index,beam_rating_score,beam_review_confidence,beam_rating_health,sentiment_avg,sentiment_avg_30d,sentiment_avg_90d,sentiment_avg_180d,sentiment_avg_360d,sentiment_percentile_1km,sentiment_percentile_5km,sentiment_percentile_10km,sentiment_score_90d,sentiment_score_360d,sentiment_positive_pct_30d,sentiment_negative_pct_30d,sentiment_neutral_pct_30d,sentiment_positive_pct_90d,sentiment_negative_pct_90d,sentiment_neutral_pct_90d,sentiment_positive_pct_180d,sentiment_negative_pct_180d,sentiment_neutral_pct_180d,sentiment_positive_pct_360d,sentiment_negative_pct_360d,sentiment_neutral_pct_360d,sentiment_trend_30vs90d,sentiment_trend_90vs360d,sentiment_diff_30vs90d,sentiment_change_360d,sentiment_diff_90vs360d,sentiment_change_pct_360d,reviews_count_30d,reviews_count_90d,reviews_count_180d,reviews_count_360d,review_growth_pct_180d,review_growth_pct_360d,review_growth_pct_90d,beam_score_overall,beam_popularity_percentile,beam_social_presence,beam_data_completeness,beam_price_value,beam_data_freshness,beam_rank_city_category,beam_rank_city_overall,beam_rank_city_reviews,beam_rank_state_category,beam_rank_state_overall,beam_rank_state_reviews,beam_rank_country_category,beam_rank_country_overall,beam_rank_country_reviews,beam_rank_place_global_category,beam_rank_category,beam_rank_competition_1km_category,beam_rank_competition_1km_total,beam_rank_competition_1km_reviews,beam_rank_competition_5km_category,beam_rank_competition_5km_total,beam_rank_competition_5km_reviews,beam_rank_competition_10km_category,beam_rank_competition_10km_total,beam_rank_competition_10km_reviews,beam_export_rank,total_city_category,total_city,total_state_category,total_state,total_country_category,total_country,total_category_global,beam_competitors_10km_competitive_strength,beam_competitors_10km_competitor_avg_sentiment_30d,beam_competitors_10km_competitor_avg_sentiment_90d,beam_competitors_10km_sentiment_diff_30d,beam_competitors_10km_sentiment_diff_90d,beam_competitors_1km_competitive_strength,beam_competitors_1km_competitor_avg_sentiment_30d,beam_competitors_1km_competitor_avg_sentiment_90d,beam_competitors_1km_sentiment_diff_30d,beam_competitors_1km_sentiment_diff_90d,beam_competitors_5km_competitive_strength,beam_competitors_5km_competitor_avg_sentiment_30d,beam_competitors_5km_competitor_avg_sentiment_90d,beam_competitors_5km_sentiment_diff_30d,beam_competitors_5km_sentiment_diff_90d,beam_competitors_10km_competitor_count,beam_competitors_1km_competitor_count,beam_competitors_5km_competitor_count,beam_competitors_1km_rank_by_score,beam_competitors_1km_rank_by_rating,beam_competitors_1km_rank_by_reviews,beam_competitors_1km_score_percentile,beam_competitors_1km_rating_percentile,beam_competitors_1km_reviews_percentile,beam_competitors_1km_health_percentile,beam_competitors_1km_sentiment_percentile,beam_competitors_1km_competitor_avg_score,beam_competitors_1km_competitor_avg_rating,beam_competitors_1km_competitor_avg_reviews,beam_competitors_1km_competitor_avg_health,beam_competitors_1km_competitor_avg_sentiment,beam_competitors_1km_score_diff,beam_competitors_1km_rating_diff,beam_competitors_1km_reviews_diff,beam_competitors_1km_health_diff,beam_competitors_1km_sentiment_diff,beam_competitors_5km_rank_by_score,beam_competitors_5km_rank_by_rating,beam_competitors_5km_rank_by_reviews,beam_competitors_5km_score_percentile,beam_competitors_5km_rating_percentile,beam_competitors_5km_reviews_percentile,beam_competitors_5km_health_percentile,beam_competitors_5km_sentiment_percentile,beam_competitors_5km_competitor_avg_score,beam_competitors_5km_competitor_avg_rating,beam_competitors_5km_competitor_avg_reviews,beam_competitors_5km_competitor_avg_health,beam_competitors_5km_competitor_avg_sentiment,beam_competitors_5km_score_diff,beam_competitors_5km_rating_diff,beam_competitors_5km_reviews_diff,beam_competitors_5km_health_diff,beam_competitors_5km_sentiment_diff,beam_competitors_10km_rank_by_score,beam_competitors_10km_rank_by_rating,beam_competitors_10km_rank_by_reviews,beam_competitors_10km_score_percentile,beam_competitors_1km_competitive_tier,beam_competitors_10km_rating_percentile,beam_competitors_10km_reviews_percentile,beam_competitors_10km_health_percentile,beam_competitors_10km_sentiment_percentile,beam_competitors_5km_competitive_tier,beam_competitors_10km_competitor_avg_score,beam_competitors_10km_competitor_avg_rating,beam_competitors_10km_competitor_avg_reviews,beam_competitors_10km_competitor_avg_health,beam_competitors_10km_competitive_tier,beam_competitors_10km_competitor_avg_sentiment,beam_competitors_10km_score_diff,beam_competitors_10km_rating_diff,beam_competitors_10km_reviews_diff,beam_competitors_10km_health_diff,beam_competitors_10km_sentiment_diff,beam_competitors_1km_total_in_radius,beam_competitors_5km_total_in_radius,beam_competitors_10km_total_in_radius,beam_competitors_1km_avg_distance_m,beam_competitors_1km_closest_competitor_m,beam_competitors_1km_market_type,beam_competitors_1km_review_share,beam_competitors_1km_density_per_sqkm,beam_competitors_1km_tier_below_40,beam_competitors_1km_tier_40_59,beam_competitors_1km_tier_60_79,beam_competitors_1km_tier_80_100,beam_competitors_5km_avg_distance_m,beam_competitors_5km_closest_competitor_m,beam_competitors_5km_market_type,beam_competitors_5km_review_share,beam_competitors_5km_density_per_sqkm,beam_competitors_5km_tier_below_40,beam_competitors_5km_tier_40_59,beam_competitors_5km_tier_60_79,beam_competitors_5km_tier_80_100,beam_competitors_10km_avg_distance_m,beam_competitors_10km_closest_competitor_m,beam_competitors_10km_market_type,beam_competitors_10km_review_share,beam_competitors_10km_density_per_sqkm,beam_competitors_10km_tier_below_40,beam_competitors_10km_tier_40_59,beam_competitors_10km_tier_60_79,beam_competitors_10km_tier_80_100,beam_competitors_city_competitor_avg_sentiment_30d,beam_competitors_city_competitor_avg_sentiment_90d,beam_competitors_city_sentiment_diff_30d,beam_competitors_city_sentiment_diff_90d,beam_competitors_city_competitor_count,beam_competitors_city_total_in_city,beam_competitors_city_rank_by_score,beam_competitors_city_rank_by_rating,beam_competitors_city_rank_by_reviews,beam_competitors_city_score_percentile,beam_competitors_city_rating_percentile,beam_competitors_city_reviews_percentile,beam_competitors_city_health_percentile,beam_competitors_city_sentiment_percentile,beam_competitors_city_competitor_avg_score,beam_competitors_city_competitor_avg_rating,beam_competitors_city_competitor_avg_reviews,beam_competitors_city_competitor_avg_health,beam_competitors_city_competitor_avg_sentiment,beam_competitors_city_score_diff,beam_competitors_city_rating_diff,beam_competitors_city_reviews_diff,beam_competitors_city_health_diff,beam_competitors_city_sentiment_diff,beam_competitors_city_market_type,beam_competitors_city_review_share,beam_competitors_city_density_per_sqkm,beam_competitors_city_tier_below_40,beam_competitors_city_tier_40_59,beam_competitors_city_tier_60_79,beam_competitors_city_tier_80_100,beam_competitors_city_competitive_strength,beam_competitors_city_underserved_score,beam_competitors_city_competition_intensity,beam_competitors_state_competitor_avg_sentiment_30d,beam_competitors_state_competitor_avg_sentiment_90d,beam_competitors_state_sentiment_diff_30d,beam_competitors_state_sentiment_diff_90d,beam_competitors_state_competitor_count,beam_competitors_state_total_in_state,beam_competitors_state_rank_by_score,beam_competitors_state_rank_by_rating,beam_competitors_state_rank_by_reviews,beam_competitors_state_score_percentile,beam_competitors_state_rating_percentile,beam_competitors_state_reviews_percentile,beam_competitors_state_health_percentile,beam_competitors_state_sentiment_percentile,beam_competitors_state_competitor_avg_score,beam_competitors_state_competitor_avg_rating,beam_competitors_state_competitor_avg_reviews,beam_competitors_state_competitor_avg_health,beam_competitors_state_competitor_avg_sentiment,beam_competitors_state_score_diff,beam_competitors_state_rating_diff,beam_competitors_state_reviews_diff,beam_competitors_state_health_diff,beam_competitors_state_sentiment_diff,beam_competitors_state_market_type,beam_competitors_state_review_share,beam_competitors_state_density_per_sqkm,beam_competitors_state_underserved_score,beam_competitors_state_competition_intensity,beam_competitors_state_competitive_strength,beam_competitors_country_competitor_avg_sentiment_30d,beam_competitors_country_competitor_avg_sentiment_90d,beam_competitors_country_sentiment_diff_30d,beam_competitors_country_sentiment_diff_90d,beam_competitors_country_competitor_count,beam_competitors_country_competitor_avg_score,beam_competitors_country_competitor_avg_rating,beam_competitors_country_competitor_avg_reviews,beam_competitors_country_competitor_avg_health,beam_competitors_country_competitor_avg_sentiment,beam_competitors_country_score_diff,beam_competitors_country_rating_diff,beam_competitors_country_reviews_diff,beam_competitors_country_sentiment_diff,beam_competitors_country_score_percentile,beam_competitors_country_rating_percentile,beam_competitors_country_reviews_percentile,beam_competitors_country_health_percentile,beam_competitors_country_sentiment_percentile,beam_competitors_country_rank_by_score,beam_competitors_country_competitive_strength,beam_competitors_country_health_diff,beam_competitors_country_rank_by_rating,beam_competitors_country_rank_by_reviews,beam_competitors_country_tier_40_59,beam_competitors_country_tier_60_79,beam_competitors_country_tier_80_100,beam_competitors_country_tier_below_40,beam_competitors_country_total_in_country,beam_competitors_city_siblings_competitor_count,beam_competitors_city_siblings_competitor_avg_score,beam_competitors_city_siblings_competitor_avg_rating,beam_competitors_city_siblings_competitor_avg_reviews,beam_competitors_city_siblings_competitor_avg_health,beam_competitors_city_siblings_competitor_avg_sentiment,beam_competitors_city_siblings_score_diff,beam_competitors_city_siblings_rating_diff,beam_competitors_city_siblings_reviews_diff,beam_competitors_city_siblings_sentiment_diff,beam_competitors_city_siblings_score_percentile,beam_competitors_city_siblings_rating_percentile,beam_competitors_city_siblings_reviews_percentile,beam_competitors_city_siblings_health_percentile,beam_competitors_city_siblings_sentiment_percentile,beam_competitors_city_siblings_rank_by_score,beam_competitors_city_siblings_competitor_avg_recommend_pct,beam_competitors_city_siblings_recommend_pct_diff,beam_competitors_city_siblings_recommend_pct_percentile,beam_competitors_city_siblings_total_siblings,beam_competitors_city_businesses_per_10k_pop,beam_competitors_city_population_per_business,beam_competitors_city_population_density,beam_competitors_city_reviews_per_capita,beam_competitors_city_reviews_per_10k_pop,beam_competitors_state_businesses_per_10k_pop,beam_competitors_state_population_per_business,beam_competitors_state_population_density,beam_competitors_state_reviews_per_capita,beam_competitors_state_reviews_per_10k_pop,beam_competitors_1km_hhi_contribution,beam_competitors_1km_hhi_minimum,beam_competitors_5km_hhi_contribution,beam_competitors_5km_hhi_minimum,beam_competitors_10km_hhi_contribution,beam_competitors_10km_hhi_minimum,beam_competitors_city_hhi_contribution,beam_competitors_city_hhi_minimum,beam_competitors_state_hhi_contribution,beam_competitors_state_hhi_minimum,beam_trends_score_30d_beam_score_overall,beam_trends_score_30d_rating,beam_trends_score_30d_review_count,beam_trends_score_30d_beam_rating_health,beam_trends_score_30d_beam_popularity_percentile,beam_trends_score_90d_beam_score_overall,beam_trends_score_90d_rating,beam_trends_score_90d_review_count,beam_trends_score_90d_beam_rating_health,beam_trends_score_90d_beam_popularity_percentile,beam_trends_competitive_1km_30d_strength_change,beam_trends_competitive_1km_30d_rank_change,beam_trends_competitive_1km_30d_percentile_change,beam_trends_competitive_1km_90d_strength_change,beam_trends_competitive_1km_90d_rank_change,beam_trends_competitive_1km_90d_percentile_change,beam_trends_competitive_5km_30d_strength_change,beam_trends_competitive_5km_30d_rank_change,beam_trends_competitive_5km_30d_percentile_change,beam_trends_competitive_5km_90d_strength_change,beam_trends_competitive_5km_90d_rank_change,beam_trends_competitive_5km_90d_percentile_change,beam_trends_competitive_10km_30d_strength_change,beam_trends_competitive_10km_30d_rank_change,beam_trends_competitive_10km_30d_percentile_change,beam_trends_competitive_10km_90d_strength_change,beam_trends_competitive_10km_90d_rank_change,beam_trends_competitive_10km_90d_percentile_change,beam_trends_competitive_city_30d_strength_change,beam_trends_competitive_city_30d_rank_change,beam_trends_competitive_city_30d_percentile_change,beam_trends_competitive_city_90d_strength_change,beam_trends_competitive_city_90d_rank_change,beam_trends_competitive_city_90d_percentile_change,beam_trends_competitive_state_30d_strength_change,beam_trends_competitive_state_30d_rank_change,beam_trends_competitive_state_30d_percentile_change,beam_trends_competitive_state_90d_strength_change,beam_trends_competitive_state_90d_rank_change,beam_trends_competitive_state_90d_percentile_change,beam_trends_sentiment_current_sentiment,beam_trends_sentiment_positive_ratio,beam_trends_sentiment_negative_ratio,beam_trends_sentiment_review_count,beam_trends_velocity_reviews_per_day,beam_trends_velocity_reviews_per_month,beam_trends_velocity_percentile_city,beam_trends_velocity_percentile_state,beam_trends_velocity_trend,beam_velocity_reviews_per_day,beam_velocity_reviews_per_week,beam_velocity_reviews_per_month,beam_velocity_reviews_last_30d,beam_velocity_reviews_last_90d,beam_velocity_reviews_last_365d,beam_velocity_percentile_1km,beam_velocity_percentile_5km,beam_velocity_percentile_10km,beam_velocity_percentile_city,beam_velocity_percentile_state,beam_velocity_rank_1km,beam_velocity_rank_5km,beam_velocity_rank_10km,beam_velocity_rank_city,beam_velocity_rank_state,beam_velocity_trend,beam_velocity_change_30d,beam_velocity_change_90d,beam_trends_sentiment_recommend_pct
7X6YA42T,Empire Wingz,Food and Drink,Restaurants,Restaurant,Restaurant,"1521 Ambassador Caffery Pkwy, Lafayette, LA 70506",1521 Ambassador Caffery Pkwy,Lafayette,Louisiana,,,70506,US,True,30.2199775,-92.07531019999999,America/Chicago,(337) 88*-****,1,,TRUE,TRUE,,True,Lafayette,Louisiana,US,https,https://empirewingz.com,empirewingz.com,empirewingz.com,com,2170,2020-05-05,2027-05-05,"Amazon Registrar, Inc.",,,0,0,0,,TRUE,FALSE,0,0,"{""1"": 0, ""2"": 0, ""3"": 0, ""4"": 0, ""5"": 0}","No-contact delivery, Delivery, Takeout, Dine-in",Sports,,"Wheelchair accessible entrance, Wheelchair accessible parking lot, Wheelchair accessible restroom, Wheelchair accessible seating",Late-night food,"Lunch, Dinner, Catering, Counter service, Dessert, Seating","Restroom, Wi-Fi",,,,"Credit cards, Debit cards",,FALSE,TRUE,purchase_dataset@,FALSE,TRUE,0,,,,,,,,,,,,,,,,,,,,,,,,,,,,,,,,,,,,,,,,,,,https://empirewingz.com,,,2026-04-11T13:13:20.418917+00:00,,,,,,,,0.0,0.0,50.0,,,,,,,,,,,,,,,,,,,,,,,,,,,,,,,,,,,,27.7,19.5,0,50,50.0,96.0,555,1280,1280,9865,20951,20951,680098,1391710,1391710,733882,555,,,,,,,,,,534,598,1209,10973,22810,735647,1464979,735647,,,,,,,,,,,,,,,,,,,,,,,,,,,,,,,,,,,,,,,,,,,,,,,,,,,,,,,,,,,,,,,,,,,,,,,,,,,,,,,,,,,,,,,,,,,,,,,,,,,,,,,,,,,,,,,,,,,,,,,,,,,,,,,,,,,,,,,,,,,,,,,,,,,,,,,,,,,,,,,,,,,,,,,,,,,,,,,,,,,,,,,,,,,,,,,,,,,,,,,451,61.9,4.32,325,79.2,0.4968,-34.2,,-325,-0.4968,0.0756,0.9,0.0,0.0289,0.0356,414,57.51,-57.51,0.0,451,,,,,,,,,,,,,,,,,,,,,0.0,,0,0.0,0.0,,,,,,,,,,,,,,,,,,,,,,,,,,,,,,,,,,,,,,,,,,,,,,,,,,,,,,,,,,,,,,,,
GF2MTPJB,Quiznos,Food and Drink,Restaurants,Sandwich shop,"Sandwich shop, Caterer, Deli, Fast food restaurant, Restaurant","2668 Johnston St Ste A2, Lafayette, LA 70503",2668 Johnston St Ste A2,Lafayette,Louisiana,,,70503,US,True,30.20883,-92.03811069999999,America/Chicago,(337) 23*-****,1,CLOSED_TEMPORARILY,FALSE,TRUE,,True,Lafayette,Louisiana,US,http,http://restaurants.quiznos.com,restaurants.quiznos.com,restaurants.quiznos.com,com,10585,1997-04-21,2027-04-22,"NameCheap, Inc.",,,0,0,0,"Known for toasted, build-your-own subs, this counter-serve chain also sells soups, salads & more.",TRUE,TRUE,3.3,0,"{""1"": 17, ""2"": 2, ""3"": 4, ""4"": 10, ""5"": 20}","Delivery, Takeout",,,Wheelchair accessible restroom,"Small plates, Vegetarian options","Breakfast, Lunch, Dinner, Catering, Counter service, Dessert, Seating","Restroom, Wi-Fi",,"LGBTQ+ friendly, Transgender safespace",,"Credit cards, Debit cards, NFC mobile payments","Good for kids, High chairs, Kids' menu",FALSE,TRUE,purchase_dataset@,FALSE,TRUE,0,,,,,,,,,,,,,,,,,,,,,,,,,,,,,,,,,,,,,,,,,,,https://quiznos.com/menu,,,2026-04-10T23:06:55.142589+00:00,,,,,,,,0.0,0.0,50.0,,,,,,,,,,,,,,,,,,,,,,,,,,,,,,,,,,,,27.6,19.5,0,67,50.0,60.0,572,1325,1325,10261,21972,21972,699313,1449146,1449146,754572,572,,,,,,,,,,534,598,1209,10973,22810,735647,1464979,735647,,,,,,,,,,,,,,,,,,,,,,,,,,,,,,,,,,,,,,,,,,,,,,,,,,,,,,,,,,,,,,,,,,,,,,,,,,,,,,,,,,,,,,,,,,,,,,,,,,,,,,,,,,,,,,,,,,,,,,,,,,,,,,,,,,,,,,,,,,,,,,,,,,,,,,,,,,,,,,,,,,,,,,,,,,,,,,,,,,,,,,,,,,,,,,,,,,,,,,,139,63.7,4.01,395,72.2,0.4183,-36.1,,-395,-0.4183,0.058,0.9493,0.0,0.029,0.0145,131,67.01,-67.01,0.0,139,,,,,,,,,,,,,,,,,,,,,0.0,,0,0.0,0.0,,,,,,,,,,,,,,,,,,,,,,,,,,,,,,,,,,,,,,,,,,,,,,,,,,,,,,,,,,,,,,,,
WNPABACD,Morvant’s On The Go,Food and Drink,Restaurants,Mobile caterer,"Mobile caterer, Service establishment",,,Lafayette,Louisiana,,,,US,True,30.248621999999997,-92.0395585,America/Chicago,(337) 91*-****,0,OPERATIONAL,FALSE,FALSE,,True,Lafayette,Louisiana,US,,,,,,,,,,,,0,0,0,,TRUE,FALSE,5,0,"{""1"": 0, ""2"": 0, ""3"": 0, ""4"": 0, ""5"": 1}",Delivery,,,,,,,,,,,,FALSE,FALSE,purchase_dataset@,FALSE,TRUE,0,,,,,,,,,,,,,,,,,,,,,,,,,,,,,,,,,,,,,,,,,,,,,,2026-04-10T22:15:41.500505+00:00,,,,,,,,0.0,0.0,50.0,,,,,,,,,,,,,,,,,,,,,,,,,,,,,,,,,,,,24.1,19.5,0,33,50.0,58.0,596,1406,1406,10857,23706,23706,729092,1544697,1544697,786755,596,,,,,,,,,,534,598,1209,10973,22810,735647,1464979,735647,,,,,,,,,,,,,,,,,,,,,,,,,,,,,,,,,,,,,,,,,,,,,,,,,,,,,,,,,,,,,,,,,,,,,,,,,,,,,,,,,,,,,,,,,,,,,,,,,,,,,,,,,,,,,,,,,,,,,,,,,,,,,,,,,,,,,,,,,,,,,,,,,,,,,,,,,,,,,,,,,,,,,,,,,,,,,,,,,,,,,,,,,,,,,,,,,,,,,,,451,61.9,4.32,325,79.2,0.4968,-37.8,,-325,-0.4968,0.0111,0.9,0.0,0.0289,0.0356,443,57.51,-57.51,0.0,451,,,,,,,,,,,,,,,,,,,,,0.0,,0,0.0,0.0,,,,,,,,,,,,,,,,,,,,,,,,,,,,,,,,,,,,,,,,,,,,,,,,,,,,,,,,,,,,,,,,
TMPR9QGN,Off The Hook,Food and Drink,Restaurants,Seafood restaurant,"Seafood restaurant, Cajun restaurant, Chicken restaurant","101 Liberty Ave, Lafayette, LA 70508",101 Liberty Ave,Lafayette,Louisiana,,,70508,US,True,30.1620316,-92.0423406,America/Chicago,(337) 53*-****,2,OPERATIONAL,TRUE,TRUE,,True,Lafayette,Louisiana,US,https,https://othook.com/locations/lafayette,othook.com/locations/lafayette,othook.com,com,4535,2013-11-13,2026-11-13,"GKG.Net, Inc.","purchase_dataset@othook.com, purchase_dataset@offthehook.com, purchase_dataset@othook.com",realdomain,3,2,1,,TRUE,FALSE,4.36,58,"{""1"": 4, ""2"": 5, ""3"": 8, ""4"": 7, ""5"": 65}","Delivery, Drive-through, Takeout, Dine-in",,"Dinner, Solo dining","Wheelchair accessible entrance, Wheelchair accessible parking lot, Wheelchair accessible restroom, Wheelchair accessible seating","Comfort food, Quick bite","Lunch, Dinner, Catering, Dessert",Restroom,Casual,,,"Credit cards, Debit cards",Good for kids,FALSE,TRUE,purchase_dataset@,TRUE,TRUE,3,,,,,,,,,,,,https://www.facebook.com/offthehookrestaurants,offthehookrestaurants,https://twitter.com/othook,othook,,,https://www.linkedin.com/company/off-the-hook-restaurants,off-the-hook-restaurants,,,,,,,,,,,,,,,,,,,,,,,,,,,2026-04-10T12:16:20.642804+00:00,0.0,1.26,2.8,6642.2,210.7,121.2485,0.82,87.2,59.0,82.8,0.6891,,0.6456,0.6891,0.6891,0.6122,0.6648,0.4228,82.3,84.5,,,,81.82,15.15,3.03,84.48,13.79,1.72,84.48,13.79,1.72,stable,stable,,-2.2,-0.0435,-2.6,0,33,58,58,13.8,127.6,-100.0,70.1,41.5,24,83,82.6,100.0,400,700,768,7077,10485,12468,514274,685464,915131,552724,400,139192,68,248185,242825,101,347725,359731,101,535764,270,598,1209,10973,22810,735647,1464979,735647,0.4447,0.0755,0.5412,-0.0755,0.1246,0.7095,0.0788,0.3109,-0.0788,0.3549,0.6429,0.0338,0.4795,-0.0338,0.1863,100,67,100,139192,275276,248185,0.8086,0.6207,0.666,0.5404,0.6122,68.0,4.09,500,77.9,0.5216,2.1,0.27,-442,4.9,0.1675,242825,212034,347725,0.6736,0.7045,0.5404,0.6937,0.6648,73.6,4.34,664,83.1,0.6119,-3.5,0.02,-606,-0.3,0.0772,359731,355012,535764,0.5148,Strong,0.5096,0.2863,0.4814,0.4228,Average,74.5,4.33,566,82.6,Average,0.5916,-4.4,0.03,-508,0.2,0.0975,68,101,101,687,125,competitive,0.0017,21.33,1.5,19.4,67.2,11.9,3530,1010,competitive,0.0009,1.27,0.0,0.0,90.0,10.0,7108,5109,competitive,0.001,0.32,0.0,0.0,85.0,15.0,0.0472,0.5838,-0.0472,0.082,100,101,253,391,511,0.6228,0.4087,0.2365,0.4656,0.6692,77.1,4.45,806,86.1,0.6674,-7.0,-0.09,-748,-3.3,0.0217,competitive,0.0007,0.69,0.0,0.0,72.0,28.0,0.4427,0.82,6.35,0.0844,0.7068,-0.0844,-0.041,100,101,3506,5901,8766,0.6977,0.4885,0.251,0.556,0.7263,79.9,4.67,1185,91.9,0.7579,-9.8,-0.31,-1127,-9.1,-0.0688,competitive,0.0005,0.0007,1.12,0.17,0.5009,0.08,0.3009,-0.08,0.3649,793989,61.4,3.79,385,76.0,0.4601,8.7,0.57,-327,0.229,0.6821,0.4982,0.303,0.5574,0.716,249822,0.5132,6.8,391781,552023,25.1,59.3,4.4,11.2,793990,451,61.9,4.32,325,79.2,0.4968,8.2,0.04,-267,0.1923,0.6444,0.3822,0.3511,0.4422,0.6578,161,57.51,23.62,0.5622,451,8.24,1214,833,0.6642,6642.2,0.21,46578,34,0.0254,254.49,0.03,147.06,0.01,99.01,0.01,99.01,0.01,99.01,0.0,99.01,-0.1,0.04,-10,3.4,-15.2,,,,,,0.03,-34495,0.05,-41.39,-260282,0.36,0.05,-29989,0.045,-41.56,-161211,0.223,0.06,-61572,0.089,-41.86,-38972,0.063,-0.04,12,-0.009,-41.76,-442320,0.172,-0.02,-43,0.009,-41.7,-441338,0.245,0.6891,,,58,0.27,8.0,1.0,0.941,decelerating,0.27,1.87,8.00,8,52,66,0.964,0.965,0.965,1.000,0.941,27904,29109,29110,1,22,decelerating,-0.33,,81.13
